{
  "meta": {
    "schemaVersion": "1.0.0",
    "generatedAt": "2026-01-01T00:00:00.000Z",
    "repos": ["fixture-repo"],
    "counts": { "nodes": 11, "edges": 12, "financialFlows": 7 }
  },
  "nodes": [
    { "id": "n:fund:alpha-fund", "type": "Fund", "label": "Alpha Fund", "repo": "fixture-repo", "evidenceStatus": "documented",
      "provenance": [{ "sourceDoc": "fixtures/source.md", "sourceLocation": "lines 1-1" }] },
    { "id": "n:fund:beta-fund", "type": "Fund", "label": "Beta Fund", "repo": "fixture-repo", "evidenceStatus": "documented",
      "provenance": [{ "sourceDoc": "fixtures/source.md", "sourceLocation": "lines 2-2" }] },
    { "id": "n:grant:gamma-grant", "type": "Grant", "label": "Gamma Grant", "repo": "fixture-repo", "evidenceStatus": "documented",
      "provenance": [{ "sourceDoc": "fixtures/source.md", "sourceLocation": "lines 3-3" }] },
    { "id": "n:agency:mid-agency", "type": "GovernmentAgency", "label": "Middle Agency", "repo": "fixture-repo", "evidenceStatus": "documented",
      "provenance": [{ "sourceDoc": "fixtures/source.md", "sourceLocation": "lines 4-4" }] },
    { "id": "n:org:mid-org", "type": "Organization", "label": "Middle Org", "repo": "fixture-repo", "evidenceStatus": "documented",
      "provenance": [{ "sourceDoc": "fixtures/source.md", "sourceLocation": "lines 5-5" }] },
    { "id": "n:program:services-program", "type": "Program", "label": "Services Program", "repo": "fixture-repo", "evidenceStatus": "documented",
      "provenance": [{ "sourceDoc": "fixtures/source.md", "sourceLocation": "lines 6-6" }] },
    { "id": "n:proposal:future-program", "type": "Proposal", "label": "Future Program (proposed)", "repo": "fixture-repo", "evidenceStatus": "proposed",
      "provenance": [{ "sourceDoc": "fixtures/source.md", "sourceLocation": "lines 7-7" }] },
    { "id": "n:project:build-project", "type": "Project", "label": "Build Project", "repo": "fixture-repo", "evidenceStatus": "documented",
      "provenance": [{ "sourceDoc": "fixtures/source.md", "sourceLocation": "lines 8-8" }] },
    { "id": "n:population:target-group", "type": "Population", "label": "Target Group", "repo": "fixture-repo", "evidenceStatus": "documented",
      "provenance": [{ "sourceDoc": "fixtures/source.md", "sourceLocation": "lines 9-9" }] },
    { "id": "n:unknown:lost-endpoint", "type": "UnknownEntity", "label": "Unknown destination", "repo": "fixture-repo", "evidenceStatus": "unknown",
      "provenance": [{ "sourceDoc": "fixtures/source.md", "sourceLocation": "lines 10-10" }] },
    { "id": "n:need:unmet-need", "type": "Need", "label": "Unmet Need", "repo": "fixture-repo", "evidenceStatus": "documented",
      "provenance": [{ "sourceDoc": "fixtures/source.md", "sourceLocation": "lines 11-11" }] }
  ],
  "edges": [
    { "id": "e:aaaaaaaaaaa1", "source": "n:fund:alpha-fund", "target": "n:program:services-program", "type": "FUNDS",
      "description": "Scenario 1+8+9: complete documented path, one of two funders, budget mechanism", "repo": "fixture-repo",
      "evidenceStatus": "documented", "confidence": "high",
      "provenance": [{ "sourceDoc": "fixtures/source.md", "sourceLocation": "lines 12-12" }],
      "financial": { "amountUSD": 100000, "currency": "USD", "mechanism": "budget", "status": "committed" },
      "flowId": "f:complete" },
    { "id": "e:aaaaaaaaaaa2", "source": "n:program:services-program", "target": "n:population:target-group", "type": "DELIVERS_SERVICE_TO",
      "description": "Scenario 1: program delivers to final beneficiary", "repo": "fixture-repo",
      "evidenceStatus": "documented", "confidence": "high",
      "provenance": [{ "sourceDoc": "fixtures/source.md", "sourceLocation": "lines 13-13" }] },
    { "id": "e:aaaaaaaaaaa3", "source": "n:fund:beta-fund", "target": "n:proposal:future-program", "type": "FUNDS",
      "description": "Scenario 2: proposed funding never delivered", "repo": "fixture-repo",
      "evidenceStatus": "proposed", "confidence": "medium",
      "provenance": [{ "sourceDoc": "fixtures/source.md", "sourceLocation": "lines 14-14" }],
      "financial": { "amountUSD": 50000, "currency": "USD", "mechanism": "grant", "status": "proposed" },
      "flowId": "f:proposed" },
    { "id": "e:aaaaaaaaaaa4", "source": "n:grant:gamma-grant", "target": "n:org:mid-org", "type": "GRANTS_TO",
      "description": "Scenario 3: disputed flow", "repo": "fixture-repo",
      "evidenceStatus": "disputed", "confidence": "low",
      "provenance": [{ "sourceDoc": "fixtures/source.md", "sourceLocation": "lines 15-15" }],
      "financial": { "amountUSD": 25000, "currency": "USD", "mechanism": "grant", "status": "unknown" },
      "flowId": "f:disputed" },
    { "id": "e:aaaaaaaaaaa5", "source": "n:fund:alpha-fund", "target": "n:unknown:lost-endpoint", "type": "DISTRIBUTES_TO",
      "description": "Scenario 4: money with unknown destination", "repo": "fixture-repo",
      "evidenceStatus": "unknown", "confidence": "low",
      "provenance": [{ "sourceDoc": "fixtures/source.md", "sourceLocation": "lines 16-16" }],
      "financial": { "amountUSD": 40000, "currency": "USD", "mechanism": null, "status": "unknown" },
      "flowId": "f:unknown-dest" },
    { "id": "e:aaaaaaaaaaa6", "source": "n:fund:alpha-fund", "target": "n:agency:mid-agency", "type": "APPROPRIATES_TO",
      "description": "Scenario 5: multi-intermediary stage 1", "repo": "fixture-repo",
      "evidenceStatus": "documented", "confidence": "high",
      "provenance": [{ "sourceDoc": "fixtures/source.md", "sourceLocation": "lines 17-17" }],
      "financial": { "amountUSD": 200000, "currency": "USD", "mechanism": "appropriation", "status": "committed" },
      "flowId": "f:multi" },
    { "id": "e:aaaaaaaaaaa7", "source": "n:agency:mid-agency", "target": "n:org:mid-org", "type": "PASSES_THROUGH",
      "description": "Scenario 5: multi-intermediary stage 2", "repo": "fixture-repo",
      "evidenceStatus": "documented", "confidence": "high",
      "provenance": [{ "sourceDoc": "fixtures/source.md", "sourceLocation": "lines 18-18" }],
      "financial": { "amountUSD": 180000, "currency": "USD", "mechanism": "pass-through", "status": "disbursed" },
      "flowId": "f:multi" },
    { "id": "e:aaaaaaaaaaa8", "source": "n:org:mid-org", "target": "n:program:services-program", "type": "DISTRIBUTES_TO",
      "description": "Scenario 5: multi-intermediary stage 3", "repo": "fixture-repo",
      "evidenceStatus": "documented", "confidence": "high",
      "provenance": [{ "sourceDoc": "fixtures/source.md", "sourceLocation": "lines 19-19" }],
      "financial": { "amountUSD": 150000, "currency": "USD", "mechanism": "subgrant", "status": "disbursed" },
      "flowId": "f:multi" },
    { "id": "e:aaaaaaaaaaa9", "source": "n:fund:beta-fund", "target": "n:project:build-project", "type": "FUNDS",
      "description": "Scenario 6: partial disbursement", "repo": "fixture-repo",
      "evidenceStatus": "documented", "confidence": "high",
      "provenance": [{ "sourceDoc": "fixtures/source.md", "sourceLocation": "lines 20-20" }],
      "financial": { "amountUSD": 80000, "currency": "USD", "mechanism": "capital budget", "status": "partially_disbursed" },
      "flowId": "f:partial" },
    { "id": "e:aaaaaaaaaa10", "source": "n:grant:gamma-grant", "target": "n:project:build-project", "type": "GRANTS_TO",
      "description": "Scenario 7: conflicting amount, source A says $10,000", "repo": "fixture-repo",
      "evidenceStatus": "documented", "confidence": "medium",
      "provenance": [{ "sourceDoc": "fixtures/source-a.md", "sourceLocation": "lines 1-1" }],
      "financial": { "amountUSD": 10000, "currency": "USD", "mechanism": "grant", "status": "committed" },
      "flowId": "f:conflict", "notes": "Conflicts with fixtures/source-b.md which reports $15,000." },
    { "id": "e:aaaaaaaaaa11", "source": "n:grant:gamma-grant", "target": "n:project:build-project", "type": "GRANTS_TO",
      "description": "Scenario 7: conflicting amount, source B says $15,000", "repo": "fixture-repo",
      "evidenceStatus": "disputed", "confidence": "low",
      "provenance": [{ "sourceDoc": "fixtures/source-b.md", "sourceLocation": "lines 1-1" }],
      "financial": { "amountUSD": 15000, "currency": "USD", "mechanism": "grant", "status": "committed" },
      "flowId": "f:conflict", "notes": "Conflicts with fixtures/source-a.md which reports $10,000." },
    { "id": "e:aaaaaaaaaa12", "source": "n:fund:beta-fund", "target": "n:program:services-program", "type": "GRANTS_TO",
      "description": "Scenario 8+9: second funder, different mechanism (grant vs budget)", "repo": "fixture-repo",
      "evidenceStatus": "documented", "confidence": "high",
      "provenance": [{ "sourceDoc": "fixtures/source.md", "sourceLocation": "lines 21-21" }],
      "financial": { "amountUSD": 60000, "currency": "USD", "mechanism": "grant", "status": "committed" },
      "flowId": "f:complete" }
  ],
  "financialFlows": [
    { "id": "f:complete", "label": "Alpha Fund -> Services Program -> Target Group", "repo": "fixture-repo",
      "stages": [
        { "from": "n:fund:alpha-fund", "to": "n:program:services-program", "amountUSD": 100000, "evidenceStatus": "documented" },
        { "from": "n:program:services-program", "to": "n:population:target-group", "amountUSD": null, "evidenceStatus": "documented" }
      ],
      "amountUSD": 100000, "currency": "USD", "status": "committed", "evidenceStatus": "documented", "confidence": "high",
      "provenance": [{ "sourceDoc": "fixtures/source.md", "sourceLocation": "lines 12-13" }],
      "rollup": { "originatingUSD": 100000, "committedUSD": 100000, "disbursedUSD": null, "reachingFinalUSD": null, "pctReachingFinal": null, "isEstimate": false, "methodology": "fixture" } },
    { "id": "f:proposed", "label": "Beta Fund -> Future Program (proposed)", "repo": "fixture-repo",
      "stages": [{ "from": "n:fund:beta-fund", "to": "n:proposal:future-program", "amountUSD": 50000, "evidenceStatus": "proposed" }],